{
  "schema_version": "0.5",
  "candidate_id": "44444444-4444-4444-8444-444444444444",
  "boundary_id": "research-01__tooling-01",
  "region_a": "research-01",
  "region_b": "tooling-01",
  "gradient_refs": [
    "55555555-5555-4555-8555-555555555555",
    "66666666-6666-4666-8666-666666666666",
    "77777777-7777-4777-8777-777777777777"
  ],
  "classification": "front_candidate",
  "method": "gradient_weighted_score_v1",
  "window_start": "2026-10-04T03:20:00+09:00",
  "window_end": "2026-10-04T03:25:00+09:00",
  "candidate_state": "partial",
  "confidence": 0.64,
  "weights": {
    "activity_pressure": 0.4,
    "authority_friction": 0.4,
    "effective_pressure": 0.2
  },
  "score": 0.61,
  "provenance": {
    "generated_at": "2026-10-04T03:25:02+09:00",
    "analyzer_id": "front-analyzer-01",
    "source_gradient_refs": [
      "55555555-5555-4555-8555-555555555555",
      "66666666-6666-4666-8666-666666666666",
      "77777777-7777-4777-8777-777777777777"
    ],
    "source_digest": "aaaaaaaaaaaaaaaaaaaaaaaaaaaaaaaaaaaaaaaaaaaaaaaaaaaaaaaaaaaaaaaa"
  }
}
