{
  "schema_version": "0.5",
  "candidate_id": "33333333-3333-4333-8333-333333333333",
  "boundary_id": "finance-01__safety-01",
  "region_a": "finance-01",
  "region_b": "safety-01",
  "gradient_refs": [
    "11111111-1111-4111-8111-111111111111"
  ],
  "classification": "front_candidate",
  "method": "single_metric_threshold_v1",
  "window_start": "2026-10-04T03:00:00+09:00",
  "window_end": "2026-10-04T03:05:00+09:00",
  "candidate_state": "complete",
  "confidence": 0.72,
  "strength": "moderate",
  "thresholds": {
    "activity_pressure": 0.4
  }
}
